{"runId":"2026-08-31-cn-002-metric-detail","recipeId":"cn-002","recipeName":"宫保鸡丁","category":"chinese","status":"done","startedAt":"2026-08-31T10:20:00.000Z","completedAt":"2026-08-31T10:40:00.000Z","steps":{"research":{"status":"done","attempts":1,"details":{"evidence":"workflow/evidence/cn-002-kung-pao-chicken.json","audit":"workflow/research/2026-08-31-metric-detail-audit.json","ingestion":"reused"}},"ingestion":{"status":"done","attempts":0,"details":{"unchangedDocuments":true}},"edit":{"status":"done","attempts":1,"details":{"targetOnly":true,"changedFields":["ingredients","steps"]}},"validator":{"status":"done","attempts":1,"details":{"status":"PASS","ingredientCount":11,"stepCount":7}},"review":{"status":"done","attempts":1,"details":{"status":"PASS","result":"workflow/reviews/cn-002-metric-detail.json"}},"build":{"status":"done","attempts":1,"details":{"status":"PASS","command":"npm run test:workflow:deterministic"}},"gitPush":{"status":"done","attempts":1,"details":{"remote":"origin","branch":"codex/recipe-automation","commit":"80278751c7e49cdce5102ec88fa80ffc0ef25947"}}},"sources":[],"errors":[],"branch":"codex/recipe-automation","commit":"80278751c7e49cdce5102ec88fa80ffc0ef25947"}
