{
  "runId": "2026-08-31-cn-002-t10b", "recipeId": "cn-002", "recipeName": "宫保鸡丁", "category": "chinese", "status": "in_progress",
  "startedAt": "2026-08-31T05:52:49.810Z", "completedAt": null,
  "steps": {
    "research": { "status": "done", "attempts": 1, "details": { "evidence": "workflow/evidence/cn-002-kung-pao-chicken.json", "evidenceHash": "a1b32e6df55eb5a73329323cde0044bbedf29a14ab3a1f807761e61a31a06045" } },
    "ingestion": { "status": "done", "attempts": 1, "details": { "documents": 2, "chunks": 10, "embeddingDimension": 1024 } },
    "edit": { "status": "done", "attempts": 1, "details": { "targetOnly": true, "changedFields": ["ingredients", "steps"] } }, "validator": { "status": "done", "attempts": 1, "details": { "status": "PASS", "ingredientCount": 11, "stepCount": 6 } },
    "review": { "status": "done", "attempts": 1, "details": { "status": "PASS", "result": "workflow/reviews/cn-002-kung-pao-chicken.json" } }, "build": { "status": "done", "attempts": 1, "details": { "status": "PASS", "command": "npm run test:workflow:deterministic" } },
    "gitPush": { "status": "in_progress", "attempts": 1, "details": { "remote": "origin", "branch": "codex/recipe-automation" } }
  },
  "sources": [{ "name": "The Woks of Life", "url": "https://thewoksoflife.com/kung-pao-chicken/", "status": "success", "failureReason": null }, { "name": "豆果美食", "url": "https://www.douguo.com/cookbook/3047016.html", "status": "success", "failureReason": null }],
  "errors": [], "branch": "codex/recipe-automation", "commit": null
}
