{"runId":"2026-08-31-cn-004-source-unit-fidelity","recipeId":"cn-004","recipeName":"鱼香肉丝","category":"chinese","status":"done","startedAt":"2026-08-31T11:10:00.000Z","completedAt":"2026-08-31T17:04:31.182Z","steps":{"research":{"status":"done","attempts":1,"details":{"evidence":"workflow/evidence/cn-004-yuxiang-pork.json","rule":"source-unit-fidelity"}},"ingestion":{"status":"done","attempts":0,"details":{"unchangedDocuments":true}},"edit":{"status":"done","attempts":1,"details":{"targetOnly":true,"changedFields":["ingredients","steps"]}},"validator":{"status":"done","attempts":1,"details":{"status":"PASS","ingredientCount":12,"stepCount":6,"fullBatch":true}},"review":{"status":"done","attempts":1,"details":{"status":"PASS","result":"workflow/reviews/cn-004-source-unit-fidelity.json"}},"build":{"status":"done","attempts":1,"details":{"status":"PASS","command":"npm run test:workflow:deterministic"}},"gitPush":{"status":"done","attempts":1,"details":{"remote":"origin","branch":"codex/recipe-automation","commit":"c3a8f29b0d37a2d49218f2aa2845be1055e2230e"}}},"sources":[],"errors":[],"branch":"codex/recipe-automation","commit":"c3a8f29b0d37a2d49218f2aa2845be1055e2230e"}
