{
  "runId": "2026-10-08-remaining44-west-030",
  "recipeId": "west-030",
  "recipeName": "酪乳煎饼",
  "category": "western",
  "status": "in_progress",
  "startedAt": "2026-10-08T11:56:52.318Z",
  "completedAt": null,
  "steps": {
    "research": {
      "status": "done",
      "attempts": 1,
      "details": {
        "evidencePath": "workflow/batches/2026-10-08-remaining44/west-030.base-evidence.json",
        "evidencePackageHash": "3e1b2df6acd7726eb45b51fbd063a4337278f6ea0a08ced7319cadd64a241cf8",
        "selectedSourceUrl": "https://www.bbcgoodfood.com/recipes/buttermilk-pancakes-maple-apples-pecans",
        "sourceMode": "multi_source",
        "publicationGate": "User approved text-only recipe; image requirements waived for this recipe.",
        "textOnlyAuthorization": {
          "authorizationId": "user_explicit_2026-10-09_remaining44_text_only",
          "authorizationPath": "workflow/batches/2026-10-08-remaining44/text-only-authorization.json",
          "authorizationHash": "b5cf005e786f61724cf1e18cd541c5d3b4387388b23240125d906e22f03d01b0"
        }
      }
    },
    "ingestion": {
      "status": "done",
      "attempts": 1,
      "details": {
        "selectedDocumentId": "7417b13e-b1bd-4ded-8dba-4675e86126cd",
        "documentIds": [
          "7417b13e-b1bd-4ded-8dba-4675e86126cd",
          "2be9e3f1-3a2a-45c1-996b-a495d7ebcc3f"
        ],
        "ragEvidence": 11
      }
    },
    "edit": {
      "status": "done",
      "attempts": 1,
      "details": {
        "targetId": "west-030",
        "changedFields": [
          "ingredients",
          "steps",
          "source",
          "timing",
          "servings",
          "textOnly",
          "vegetarian",
          "sourceLimitations"
        ],
        "ingredientCount": 14,
        "stepCount": 10,
        "source": "https://www.bbcgoodfood.com/recipes/buttermilk-pancakes-maple-apples-pecans",
        "evidencePath": "workflow/batches/2026-10-08-remaining44/west-030.base-evidence.json",
        "evidenceHash": "3e1b2df6acd7726eb45b51fbd063a4337278f6ea0a08ced7319cadd64a241cf8",
        "result": "整套采用所选BBC版本，包含苹果、碧根果和枫糖浆配料。保留蛋白打发与翻拌、双层装盘；总用时50分钟，4份。范围计时全部留null。",
        "unresolvedLimitations": [
          "准备及烹饪时间未单列",
          "煎锅火力、温度、第二面时间及刷锅黄油量未给",
          "面糊勺容量未定义，均已披露"
        ],
        "scopeCheck": "仅west-030改变；身份和legacy img保留，textOnly:true，无运行时媒体；未修改其他文件。"
      }
    },
    "validator": {
      "status": "done",
      "attempts": 2,
      "details": {
        "ok": true,
        "targetId": "west-030",
        "checks": [
          {
            "name": "unique_ids",
            "passed": true
          },
          {
            "name": "target_exists_once",
            "passed": true
          },
          {
            "name": "required_fields",
            "passed": true
          },
          {
            "name": "target_name",
            "passed": true
          },
          {
            "name": "target_ingredients",
            "passed": true,
            "count": 14
          },
          {
            "name": "target_steps",
            "passed": true,
            "count": 10
          },
          {
            "name": "stable_target_fields",
            "passed": true,
            "allowedChanges": [
              "source"
            ]
          },
          {
            "name": "target_changed",
            "passed": true,
            "required": true
          },
          {
            "name": "target_only_diff",
            "passed": true,
            "changed": []
          },
          {
            "name": "generated_target_exists",
            "passed": true
          }
        ],
        "errors": [],
        "commands": [
          {
            "command": "D:\\node.exe tools/build_html_demo_data.mjs",
            "passed": true,
            "status": 0,
            "stdout": "Generated 91 recipes.",
            "stderr": ""
          },
          {
            "command": "D:\\node.exe tools/test_html_demo.mjs",
            "passed": true,
            "status": 0,
            "stdout": "{\n  \"ok\": true,\n  \"recipes\": 91,\n  \"pantryItems\": 35,\n  \"verifiedMedia\": [\n    {\n      \"id\": \"cn-001\",\n      \"steps\": 6,\n      \"stepImages\": 6\n    },\n    {\n      \"id\": \"cn-002\",\n      \"steps\": 7,\n      \"stepImages\": 6\n    },\n    {\n      \"id\": \"cn-003\",\n      \"steps\": 6,\n      \"stepImages\": 4\n    },\n    {\n      \"id\": \"cn-004\",\n      \"steps\": 7,\n      \"stepImages\": 5\n    },\n    {\n      \"id\": \"cn-005\",\n      \"steps\": 11,\n      \"stepImages\": 11\n    },\n    {\n      \"id\": \"cn-006\",\n      \"steps\": 5,\n      \"stepImages\": 3\n    },\n    {\n      \"id\": \"cn-007\",\n      \"steps\": 19,\n      \"stepImages\": 19\n    },\n    {\n      \"id\": \"cn-008\",\n      \"steps\": 9,\n      \"stepImages\": 4\n    },\n    {\n      \"id\": \"cn-009\",\n      \"steps\": 8,\n      \"stepImages\": 8\n    },\n    {\n      \"id\": \"cn-010\",\n      \"steps\": 13,\n      \"stepImages\": 13\n    },\n    {\n      \"id\": \"cn-011\",\n      \"steps\": 9,\n      \"stepImages\": 9\n    },\n    {\n      \"id\": \"cn-019\",\n      \"steps\": 8,\n      \"stepImages\": 5\n    },\n    {\n      \"id\": \"cn-020\",\n      \"steps\": 14,\n      \"stepImages\": 12\n    },\n    {\n      \"id\": \"cn-024\",\n      \"steps\": 16,\n      \"stepImages\": 15\n    },\n    {\n      \"id\": \"cn-027\",\n      \"steps\": 17,\n      \"stepImages\": 17\n    },\n    {\n      \"id\": \"cn-029\",\n      \"steps\": 13,\n      \"stepImages\": 12\n    },\n    {\n      \"id\": \"cn-031\",\n      \"steps\": 8,\n      \"stepImages\": 7\n    },\n    {\n      \"id\": \"cn-035\",\n      \"steps\": 10,\n      \"stepImages\": 7\n    },\n    {\n      \"id\": \"cn-036\",\n      \"steps\": 4,\n      \"stepImages\": 3\n    },\n    {\n      \"id\": \"cn-039\",\n      \"steps\": 27,\n      \"stepImages\": 20\n    },\n    {\n      \"id\": \"cn-040\",\n      \"steps\": 17,\n      \"stepImages\": 10\n    },\n    {\n      \"id\": \"cn-044\",\n      \"steps\": 27,\n      \"stepImages\": 9\n    },\n    {\n      \"id\": \"cn-051\",\n      \"steps\": 17,\n      \"stepImages\": 8\n    },\n    {\n      \"id\": \"cn-053\",\n      \"steps\": 16,\n      \"stepImages\": 9\n    },\n    {\n      \"id\": \"cn-054\",\n      \"steps\": 11,\n      \"stepImages\": 9\n    },\n    {\n      \"id\": \"west-004\",\n      \"steps\": 4,\n      \"stepImages\": 4\n    },\n    {\n      \"id\": \"west-006\",\n      \"steps\": 4,\n      \"stepImages\": 4\n    },\n    {\n      \"id\": \"west-011\",\n      \"steps\": 5,\n      \"stepImages\": 4\n    },\n    {\n      \"id\": \"west-012\",\n      \"steps\": 10,\n      \"stepImages\": 4\n    },\n    {\n      \"id\": \"west-020\",\n      \"steps\": 8,\n      \"stepImages\": 5\n    },\n    {\n      \"id\": \"west-024\",\n      \"steps\": 7,\n      \"stepImages\": 6\n    },\n    {\n      \"id\": \"west-031\",\n      \"steps\": 6,\n      \"stepImages\": 0\n    }\n  ],\n  \"testedRoutes\": [\n    \"home\",\n    \"pantry\",\n    \"recommendations\",\n    \"recipe\",\n    \"game\",\n    \"cook\",\n    \"shopping\",\n    \"recipes\",\n    \"me\"\n  ],\n  \"browserErrors\": []\n}",
            "stderr": ""
          },
          {
            "command": "D:\\node.exe tools/build_vercel_output.mjs",
            "passed": true,
            "status": 0,
            "stdout": "Vercel 静态构建完成：C:\\Users\\myw\\Documents\\recipe-automation\\dist\nVercel Build Output 已生成：C:\\Users\\myw\\Documents\\recipe-automation\\.vercel\\output",
            "stderr": ""
          }
        ]
      }
    },
    "review": {
      "status": "done",
      "attempts": 2,
      "details": {
        "status": "PASS",
        "issues": [],
        "summary": "已确认生成过敏原包含tree-nut，并通过详情页“树坚果”显示断言。14项原料和10步保持不变，完整采用同一BBC配方，没有混入其他候选；鸡蛋拆分、黄油分用、苹果配料、蛋白翻拌、煎制及双层装盘均与证据一致。50分钟、4份有来源依据，范围计时保持null，未补造缺失火力、温度或用量。纯文字授权适用，生成输出无运行时图片引用。重新逐行审查全部原料及步骤，语义、语法、标点、括号和分隔结构均通过；确定性生成、浏览器及构建验证通过。",
        "evidencePackageHash": "3e1b2df6acd7726eb45b51fbd063a4337278f6ea0a08ced7319cadd64a241cf8",
        "validatorPassed": true,
        "adversarialReview": {
          "ingredientSemantics": true,
          "stepGrammar": true,
          "punctuation": true,
          "renderedStructure": true
        }
      }
    },
    "build": {
      "status": "done",
      "attempts": 2,
      "details": {}
    },
    "gitPush": {
      "status": "pending",
      "attempts": 0
    }
  },
  "sources": [
    {
      "name": "BBC Good Food",
      "url": "https://www.bbcgoodfood.com/recipes/buttermilk-pancakes-maple-apples-pecans",
      "status": "success",
      "failureReason": null
    },
    {
      "name": "Serious Eats",
      "url": "https://www.seriouseats.com/light-and-fluffy-pancakes-recipe",
      "status": "success",
      "failureReason": null
    }
  ],
  "errors": [],
  "branch": "codex/recipe-automation",
  "commit": null
}
