{
  "runId": "2026-10-07-west-031-append",
  "recipeId": "west-031",
  "recipeName": "博洛尼亚肉酱",
  "category": "western",
  "status": "done",
  "startedAt": "2026-10-07T11:39:27Z",
  "completedAt": "2026-10-07T12:18:56Z",
  "steps": {
    "research": {
      "status": "done",
      "attempts": 1,
      "details": {
        "evidencePath": "workflow/evidence/2026-10-07-west-031-user-selected-final.json",
        "selectedSourceUrl": "https://www.seriouseats.com/basic-ragu-bolognese-recipe",
        "heroOnlyAuthorization": "user_explicit_2026-10-07_west-031"
      }
    },
    "ingestion": {
      "status": "done",
      "attempts": 1,
      "details": {
        "selectedDocumentId": "19217549-e928-440d-90eb-3a164426854f",
        "changedSourcesIngestedIndependently": true
      }
    },
    "edit": {
      "status": "done",
      "attempts": 1
    },
    "validator": {
      "status": "done",
      "attempts": 2,
      "details": {
        "resultPath": "workflow/validation/2026-10-07-west-031-append-retry.json"
      }
    },
    "review": {
      "status": "done",
      "attempts": 2,
      "details": {
        "resultPath": "workflow/reviews/2026-10-07-west-031-append.json",
        "status": "PASS"
      }
    },
    "build": {
      "status": "done",
      "attempts": 1,
      "details": {
        "command": "npm run test:workflow:deterministic",
        "passed": true
      }
    },
    "gitPush": {
      "status": "done",
      "attempts": 1,
      "completedAt": "2026-10-07T12:18:56Z",
      "details": {
        "branch": "codex/recipe-automation",
        "commit": "85ccd764fa81ad5f5aae78c2b94023a017e5c78d",
        "pushSucceeded": true
      }
    }
  },
  "sources": [
    {
      "name": "Serious Eats",
      "url": "https://www.seriouseats.com/basic-ragu-bolognese-recipe",
      "status": "success",
      "failureReason": null
    }
  ],
  "errors": [],
  "branch": "codex/recipe-automation",
  "commit": "85ccd764fa81ad5f5aae78c2b94023a017e5c78d"
}
