{"runId":"2026-08-31-west-004-source-unit-fidelity","recipeId":"west-004","recipeName":"凯撒沙拉","category":"western","status":"in_progress","startedAt":"2026-08-31T11:10:00.000Z","completedAt":null,"steps":{"research":{"status":"done","attempts":1,"details":{"evidence":"workflow/evidence/west-004-caesar-salad.json","rule":"source-unit-fidelity"}},"ingestion":{"status":"done","attempts":0,"details":{"unchangedDocuments":true}},"edit":{"status":"done","attempts":2,"details":{"targetOnly":true,"changedFields":["ingredients","steps"],"reviewerRedo":"restored source-supported 3 tablespoon and remaining 1/4 cup olive-oil split"}},"validator":{"status":"done","attempts":2,"details":{"status":"PASS","ingredientCount":11,"stepCount":4,"fullBatch":true}},"review":{"status":"done","attempts":2,"details":{"status":"PASS","result":"workflow/reviews/west-004-source-unit-fidelity.json","previousFailure":"Steps omitted source-supported 3 tablespoon and remaining 1/4 cup olive-oil split; returned to Editor and corrected."}},"build":{"status":"done","attempts":1,"details":{"status":"PASS","command":"npm run test:workflow:deterministic"}},"gitPush":{"status":"pending","attempts":0}},"sources":[],"errors":[],"branch":"codex/recipe-automation","commit":null}
