{
  "runId": "2026-10-07-cn-011-user-selected",
  "recipeId": "cn-011",
  "recipeName": "桂林米粉",
  "category": "chinese",
  "status": "in_progress",
  "startedAt": "2026-10-07T11:39:27Z",
  "completedAt": null,
  "steps": {
    "research": {
      "status": "done",
      "attempts": 1,
      "details": {
        "evidencePath": "workflow/evidence/2026-10-07-cn-011-user-selected-verified-final.json",
        "selectedSourceUrl": "https://www.douguo.com/cookbook/2331633.html",
        "authorization": "user_explicit_2026-10-07_cn-011"
      }
    },
    "ingestion": {
      "status": "done",
      "attempts": 1,
      "details": {
        "selectedDocumentId": "c6f9c9c2-acaf-46a9-9956-79412598d085",
        "changedSourcesIngestedIndependently": true
      }
    },
    "edit": {
      "status": "done",
      "attempts": 2
    },
    "validator": {
      "status": "done",
      "attempts": 2,
      "details": {
        "resultPath": "workflow/validation/2026-10-07-cn-011-user-selected-retry.json"
      }
    },
    "review": {
      "status": "done",
      "attempts": 2,
      "details": {
        "resultPath": "workflow/reviews/2026-10-07-cn-011-user-selected.json",
        "status": "PASS"
      }
    },
    "build": {
      "status": "done",
      "attempts": 1,
      "details": {
        "command": "npm run test:workflow:deterministic",
        "passed": true
      }
    },
    "gitPush": {
      "status": "pending",
      "attempts": 0
    }
  },
  "sources": [
    {
      "name": "豆果美食",
      "url": "https://www.douguo.com/cookbook/2331633.html",
      "status": "success",
      "failureReason": null
    }
  ],
  "errors": [],
  "branch": "codex/recipe-automation",
  "commit": null
}
